{
  "artifact": {
    "artifact_type": "triage_report",
    "completeness": "partial",
    "created_at": "2026-10-21T09:00:00Z",
    "jurisdictions": [
      "US"
    ],
    "skill_id": "alert-triage",
    "skill_version": "1.0.0",
    "subject_ids": [
      "subject-8805"
    ]
  },
  "claims": [
    {
      "class": "fact",
      "confidence": {
        "basis": "Direct evidence set intake",
        "level": "high"
      },
      "evidence_refs": [
        "txn:8840#/summary"
      ],
      "id": "C-001",
      "statement": "Review documented for case benign-ato-001 across 3 verified evidence sources."
    },
    {
      "class": "observation",
      "confidence": {
        "basis": "Read directly from closed world",
        "level": "high"
      },
      "evidence_refs": [
        "txn:8840#/summary",
        "txn:8841#/summary"
      ],
      "id": "C-002",
      "statement": "Observed activity pattern in verified evidence: IND-FAST-MOVEMENT-PASS-THROUGH."
    },
    {
      "class": "indicator",
      "confidence": {
        "basis": "Knowledge pack pattern match",
        "level": "moderate"
      },
      "evidence_refs": [
        "txn:8840#/summary"
      ],
      "id": "C-003",
      "indicator_ids": [
        "IND-FAST-MOVEMENT-PASS-THROUGH"
      ],
      "knowledge_ids": [
        "IND-FAST-MOVEMENT-PASS-THROUGH"
      ],
      "statement": "Transaction velocity and pattern match indicator IND-FAST-MOVEMENT-PASS-THROUGH."
    },
    {
      "class": "hypothesis",
      "competing_with": [
        "C-005"
      ],
      "confidence": {
        "basis": "Pattern velocity analysis",
        "level": "low"
      },
      "epistemic_type": "adverse_reading",
      "evidence_refs": [
        "txn:8840#/summary"
      ],
      "falsifier": "Terminal logs and point-of-sale settlement batches demonstrating routine commercial takings.",
      "id": "C-004",
      "statement": "The transaction pattern is consistent with deliberate avoidance of reporting thresholds or anomalous value transit."
    },
    {
      "class": "hypothesis",
      "competing_with": [
        "C-004"
      ],
      "confidence": {
        "basis": "Declared customer profile",
        "level": "low"
      },
      "epistemic_type": "benign_reading",
      "evidence_refs": [
        "txn:8840#/summary"
      ],
      "falsifier": "Customer declaration disclaiming cash operations or counterparty confirmation of loan repayment.",
      "id": "C-005",
      "statement": "The transactions may reflect normal seasonal cash flow variation, documented trade billing, or verified customer profile."
    },
    {
      "class": "risk_assessment",
      "confidence": {
        "basis": "Decisive gap remains on file pending secondary records",
        "level": "low"
      },
      "evidence_refs": [
        "txn:8840#/summary"
      ],
      "id": "C-006",
      "statement": "Transactional risk evaluated based on verified patterns, without asserting culpability."
    },
    {
      "class": "recommendation",
      "confidence": {
        "basis": "Documentation and review standard",
        "level": "moderate"
      },
      "evidence_refs": [
        "txn:8840#/summary"
      ],
      "explains": [
        "C-006"
      ],
      "human_approval_required": false,
      "id": "C-007",
      "knowledge_ids": [],
      "statement": "Maintain routine monitoring window; no escalation warranted based on current records."
    }
  ],
  "contract_version": "fincrime/finding/1.0.0",
  "evidence_inventory": [
    {
      "decisive": true,
      "kind": "transaction",
      "present": true,
      "source_id": "txn:8840",
      "summary": "Credit of 40,000 USD from an operating account on 2026-03-03"
    },
    {
      "decisive": false,
      "kind": "transaction",
      "present": true,
      "source_id": "txn:8841",
      "summary": "Debit of 40,000 USD to group treasury on 2026-03-03"
    },
    {
      "decisive": false,
      "kind": "document",
      "present": true,
      "source_id": "doc:8842",
      "summary": "Treasury policy describing end-of-day sweeping"
    }
  ],
  "gaps": [
    {
      "blocks_conclusion": true,
      "decisive": true,
      "description": "Secondary records for monitoring window absent from evidence set.",
      "gap_id": "G-01"
    }
  ],
  "human_decision_required": [
    {
      "decision_id": "D-01",
      "owner_role": "Compliance Officer",
      "question": "Whether to request additional commercial records or escalate to Level 2 review.",
      "would_change_if": [
        "Receipt of terminal logs and settlement batches confirming commercial source.",
        "Absence of response within standard customer outreach window."
      ]
    }
  ],
  "provenance": {
    "evidence_set_sha256": "198a4473f93d84230f5bdac8564d69237739548b9c269c0d709d08407835fecb",
    "knowledge_pack": {
      "as_of": "2026-10-21",
      "id": "core-2026-10",
      "version": "1.0.0"
    },
    "model": {
      "id": "replay-engine",
      "provider": "replay",
      "seed": 42,
      "temperature": 0
    },
    "policy_set": {
      "id": "firm-aml",
      "version": "1.0.0"
    },
    "prompt_sha256": "0000000000000000000000000000000000000000000000000000000000000000",
    "run_id": "run-replay-benign-ato-001",
    "skill_id": "alert-triage",
    "skill_version": "1.0.0",
    "timestamp": "2026-10-21T09:00:00Z"
  },
  "timeline": []
}
