{
  "artifact": {
    "artifact_type": "sar_narrative",
    "completeness": "partial",
    "created_at": "2026-10-21T09:00:00Z",
    "jurisdictions": [
      "US"
    ],
    "skill_id": "sar-narrative-draft",
    "skill_version": "1.0.0",
    "subject_ids": [
      "SUB-5003"
    ]
  },
  "claims": [
    {
      "class": "fact",
      "confidence": {
        "basis": "Direct evidence set intake",
        "level": "high"
      },
      "evidence_refs": [
        "txn:TXN-5003-1#/amount"
      ],
      "id": "C-001",
      "statement": "Review documented for case golden-sar-003 across 3 verified evidence sources."
    },
    {
      "class": "observation",
      "confidence": {
        "basis": "Read directly from closed world",
        "level": "high"
      },
      "evidence_refs": [
        "txn:TXN-5003-1#/amount",
        "txn:TXN-5003-2#/amount"
      ],
      "id": "C-002",
      "statement": "Observed activity documented in transaction records."
    },
    {
      "class": "indicator",
      "confidence": {
        "basis": "Knowledge pack pattern match",
        "level": "moderate"
      },
      "evidence_refs": [
        "txn:TXN-5003-1#/amount"
      ],
      "id": "C-003",
      "indicator_ids": [
        "IND-FAST-MOVEMENT-PASS-THROUGH"
      ],
      "knowledge_ids": [
        "IND-FAST-MOVEMENT-PASS-THROUGH"
      ],
      "statement": "Transaction velocity and pattern match indicator IND-FAST-MOVEMENT-PASS-THROUGH."
    },
    {
      "class": "hypothesis",
      "competing_with": [
        "C-005"
      ],
      "confidence": {
        "basis": "Pattern velocity analysis",
        "level": "low"
      },
      "epistemic_type": "adverse_reading",
      "evidence_refs": [
        "txn:TXN-5003-1#/amount"
      ],
      "falsifier": "Terminal logs and point-of-sale settlement batches demonstrating routine commercial takings.",
      "id": "C-004",
      "statement": "The transaction pattern is consistent with deliberate avoidance of reporting thresholds or anomalous value transit."
    },
    {
      "class": "hypothesis",
      "competing_with": [
        "C-004"
      ],
      "confidence": {
        "basis": "Declared customer profile",
        "level": "low"
      },
      "epistemic_type": "benign_reading",
      "evidence_refs": [
        "txn:TXN-5003-1#/amount"
      ],
      "falsifier": "Customer declaration disclaiming cash operations or counterparty confirmation of loan repayment.",
      "id": "C-005",
      "statement": "The transactions may reflect normal seasonal cash flow variation, documented trade billing, or verified customer profile."
    },
    {
      "class": "risk_assessment",
      "confidence": {
        "basis": "Decisive gap remains on file pending secondary records",
        "level": "low"
      },
      "evidence_refs": [
        "txn:TXN-5003-1#/amount"
      ],
      "id": "C-006",
      "statement": "Transactional risk evaluated based on verified patterns, without asserting culpability."
    },
    {
      "class": "recommendation",
      "confidence": {
        "basis": "Documentation and review standard",
        "level": "moderate"
      },
      "evidence_refs": [
        "txn:TXN-5003-1#/amount"
      ],
      "explains": [
        "C-006"
      ],
      "human_approval_required": true,
      "id": "C-007",
      "knowledge_ids": [],
      "statement": "Escalate file to senior compliance investigator for secondary compliance review."
    }
  ],
  "contract_version": "fincrime/finding/1.0.0",
  "draft_notice": {
    "text": "DRAFT - FOR INTERNAL BSA OFFICER REVIEW ONLY. NOT A FINAL SAR SUBMISSION. HUMAN APPROVAL REQUIRED PRIOR TO FILING.",
    "tool_generated": true
  },
  "evidence_inventory": [
    {
      "decisive": true,
      "kind": "transaction",
      "present": true,
      "source_id": "txn:TXN-5003-1",
      "summary": "Inbound transfer for SUB-5003"
    },
    {
      "decisive": false,
      "kind": "transaction",
      "present": true,
      "source_id": "txn:TXN-5003-2",
      "summary": "Rapid onward dispersion for SUB-5003"
    },
    {
      "decisive": false,
      "kind": "document",
      "present": true,
      "source_id": "doc:DOC-5003",
      "summary": "Customer CDD profile and discrepancy memo"
    }
  ],
  "gaps": [
    {
      "blocks_conclusion": true,
      "decisive": true,
      "description": "Secondary records for monitoring window absent from evidence set.",
      "gap_id": "G-01"
    }
  ],
  "human_decision_required": [
    {
      "decision_id": "D-01",
      "owner_role": "Compliance Officer",
      "question": "Whether to request additional commercial records or escalate to Level 2 review.",
      "would_change_if": [
        "Receipt of terminal logs and settlement batches confirming commercial source.",
        "Absence of response within standard customer outreach window."
      ]
    }
  ],
  "provenance": {
    "evidence_set_sha256": "c055fbbcce739b6127b40f0f6dcde3ba083ee1693da6efefbf7bde7a59e0b8c3",
    "knowledge_pack": {
      "as_of": "2026-10-21",
      "id": "core-2026-10",
      "version": "1.0.0"
    },
    "model": {
      "id": "replay-engine",
      "provider": "replay",
      "seed": 42,
      "temperature": 0
    },
    "policy_set": {
      "id": "firm-aml",
      "version": "1.0.0"
    },
    "prompt_sha256": "0000000000000000000000000000000000000000000000000000000000000000",
    "run_id": "run-replay-golden-sar-003",
    "skill_id": "sar-narrative-draft",
    "skill_version": "1.0.0",
    "timestamp": "2026-10-21T09:00:00Z"
  },
  "timeline": []
}
